### ISSUE TITLE
Problem : Listening interface 15.3

### ISSUE THREAD

**Issue by Elspan** [TechnitiumSoftware/DnsServer#2013]
Hello, and thank you for your amazing work!

I am currently facing an issue with the listening interface in the 15.3 release.

My servers are configured to listen on a common anycast IP, which is assigned to the loopback interface.

The problem is that packets destined for the anycast IP arrive via the main interface (e.g., eth0), but Technitium now listens on the anycast IP while binding it to the loopback interface.

15.3 :
<img width="1292" height="73" alt="Image" src="https://github.com/user-attachments/assets/a990daf3-e8c1-4b9c-a3f9-a316f0a62eca" />

15.2 :
<img width="1292" height="56" alt="Image" src="https://github.com/user-attachments/assets/b78ce5aa-b023-47d3-b0bd-1fb3a0eebbf9" />

As a result, the server is no longer able to receive packets destined for the anycast IP.

**Comment by Elspan** [comment]
Addendum : the same behavior can be observed with IPv6

**Comment by ShreyasZare** [comment]
Thanks for the feedback. Will get this changed to fix this issue most probably in a day's time. Will let you know when the update is available.

**Comment by Apachez-** [comment]
Most likely due to #1989.

I think it would be better to remove the autodetection of interface and add it as a VRF-variable instead.

Given the regression in #2013 I can very well think of a scenario where you want a loopback interface to belong to a specific VRF so doing some autodetection (or ignoring loopbacks) will probably be a bad option in the long run.

That is by default this variable is empty and it will then work as with 15.2.

But for those of us who want to bind webgui and/or DNS-service to a specific VRF (or interface) we can then do so through this variable.

For example using the patch in https://github.com/TechnitiumSoftware/DnsServer/issues/1989#issuecomment-4784049868 as base (but of course modify it to technitium-standards since that patch was a quick and dirty PoC :-) and introduce these variables as docker environment variables?

- DNS_SERVER_WEB_SERVICE_VRF: Bind to VRF (if any) or interface to be used by "Web Service Local Addresses".
- DNS_SERVER_VRF: Bind VRF (if any) or interface to be used by "DNS Server Local End Points".

Having it as optional variable to be set might also work when OS is other than Linux.

I assume there might be something similar to VRF in both Windows and MacOSX even if it might not be common?

Another option is to modify the indata check to allow for "%VRF" (or "%NIC") both as "Web Service Local Addresses" and "DNS Server Local End Points".

This way you could have a webgui working for two or more VRFs (or interfaces) at once.

Example:

Web Service Local Addresses: 10.99.0.100%MGMT
DNS Server Local End Points: 192.0.2.1%CUST_A,192.0.2.2%CUST_B,192.0.2.254%eth42

With above example the webgui would only bind to ip 10.99.0.100 using VRF MGMT. While for DNS-services we would have 192.0.2.1 using VRF CUST_A, 192.0.2.2 using VRF CUST_B and 192.0.2.254 using nic eth42.

**Comment by ShreyasZare** [comment]
@Apachez- I am planning to fix this as described [here](https://github.com/TechnitiumSoftware/DnsServer/issues/1989#issuecomment-4890546200).

Implementing VRF support with the web service is out of scope since Kestrel web server does not expose socket binding options. There is nothing really that can be done for it.

**Comment by Apachez-** [comment]
Thanks!

I commented it over at #1989.

**Comment by micush** [comment]
Same issue here. Thanks for fixing.

**Comment by Gorian** [comment]
This also broke anycast for me, with my anycast IP on loopback. It was working fine for months before the update.

I had some luck with simply moving the anycast IP off of localhost and onto a dummy IP, but it's still very fragile - it seems to work fine if I give Technitium sufficient time to bind to the interface before before I bring it up - otherwise it doesn't work.

This works (running Technitium as a Podman Quadlet):
```
ExecStartPre=/bin/sh -c 'ip link add anycast type dummy;ip addr add <ip>/32 dev anycast 2>/dev/null || true'
ExecStartPost=/bin/sh -c 'sleep 3 && ip link set anycast up'
```

But this doesn't:
```
ExecStartPre=/bin/sh -c 'ip link add anycast type dummy;ip addr add 10.0.0.53/32 dev anycast 2>/dev/null || true;ip link set anycast up'
```

If I simply don't add `ip link set anycast up` to the container at *all* and rather login manually and run that after boot, then it *also* works - it seems that I simply have to wait sufficient time after Technitium is started.

Possibly some race condition in how Technitium is binding or enumerating interfaces?

I saw someone linking something about VRFs, but I haven't done anything with them myself, simply using FRR for BGP.

**Comment by tjfholdings** [comment]
Confirming the same regression on 15.3 (Ubuntu 24.04, bare-metal install script, authoritative anycast pair, anycast /32 on a `dummy` interface). Adding **transmit-side** evidence, since receive filtering isn't the only path affected: even when a query to the anycast IP is received (via the wildcard socket), the **reply is transmitted out the dummy interface** and blackholed.

`ss -ulnp` on 15.3 shows the per-IP sockets device-bound (note the `%dummy0`):

```
UNCONN 0 0 142.248.192.53%dummy0:53 0.0.0.0:* users:(("dotnet",...))
```

tcpdump while an external client queries the anycast IP — query arrives on the ethernet interface, reply leaves on `dummy0` and never reaches the wire:

```
20:56:32.566141 enp6s19 In  IP <client>.55905 > 142.248.192.53.53: 4613+ [1au] SOA? <zone>. (52)
20:56:32.566263 dummy0  Out IP 142.248.192.53.53 > <client>.55905: 4613*- 1/0/1 SOA (91)
```

Observations that may help:

- Deterministic on two independently-built nodes; service restart does not change it (so not the bind-timing behavior reported above — in our case the interface was up long before the service started).
- TCP to the anycast IP works fine; only UDP replies are affected.
- Explicitly listing the anycast IP in **DNS Server Local End Points** vs relying on the `0.0.0.0:53` wildcard makes no difference — the device-bound per-IP socket is used for replies either way.
- Rolling back to 15.2 with identical config immediately restores correct behavior: replies leave via the routed path with the anycast source address.

Thanks for the quick turnaround on a fix.

**Comment by oliverl-21** [comment]
nasty workaround which seems to be stable for me:

```ini
# /etc/network/interfaces

iface eth0 inet static
...

auto eth0:0
iface eth0:0 inet static
  address <anycast-ip>/32

iface eth0:0 inet6 static
  address <anycast-ipv6>/128

```

in combination with exabgp multiple reloads started everything fine

**Comment by tkkost** [comment]
I also have a trouble with an anycast ip in version 15.3.

```
root@ns:~# tcpdump -ni any host 10.200.14.1
tcpdump: WARNING: any: That device doesn't support promiscuous mode
(Promiscuous mode not supported on the "any" device)
tcpdump: verbose output suppressed, use -v[v]... for full protocol decode
listening on any, link-type LINUX_SLL2 (Linux cooked v2), snapshot length 262144 bytes
20:59:15.665119 eth0  In  IP 10.200.14.1 > 10.205.0.53: ICMP echo request, id 64703, seq 33001, length 44
20:59:15.665135 eth0  Out IP 10.205.0.53 > 10.200.14.1: ICMP echo reply, id 64703, seq 33001, length 44
20:59:15.765472 eth0  In  IP 10.200.14.1 > 10.205.0.53: ICMP echo request, id 64703, seq 33002, length 44
20:59:15.765484 eth0  Out IP 10.205.0.53 > 10.200.14.1: ICMP echo reply, id 64703, seq 33002, length 44
20:59:26.260067 eth0  In  IP 10.200.14.1.11944 > 10.205.0.53.53: 24632+ A? google.com. (28)
20:59:26.260124 eth0  In  IP 10.200.14.1.11944 > 10.205.0.53.53: 24633+ AAAA? google.com. (28)
20:59:26.260401 lo    In  IP 10.205.0.53.53 > 10.200.14.1.11944: 24632 6/0/0 A 172.217.209.138, A 172.217.209.139, A 172.217.209.102, A 172.217.209.113, A 172.217.209.100, A 172.217.209.101 (124)
20:59:26.264935 lo    In  IP 10.205.0.53.53 > 10.200.14.1.11944: 24633 4/0/0 AAAA 2404:6800:400a:1001::71, AAAA 2404:6800:400a:1001::66, AAAA 2404:6800:400a:1001::64, AAAA 2404:6800:400a:1001::65 (140)
20:59:28.762702 eth0  In  IP 10.200.14.1.11944 > 10.205.0.53.53: 24632+ A? google.com. (28)
20:59:28.762733 eth0  In  IP 10.200.14.1.11944 > 10.205.0.53.53: 24633+ AAAA? google.com. (28)
20:59:28.763026 lo    In  IP 10.205.0.53.53 > 10.200.14.1.11944: 24632 6/0/0 A 172.217.209.113, A 172.217.209.101, A 172.217.209.100, A 172.217.209.138, A 172.217.209.139, A 172.217.209.102 (124)
20:59:28.763027 lo    In  IP 10.205.0.53.53 > 10.200.14.1.11944: 24633 4/0/0 AAAA 2404:6800:400a:1001::66, AAAA 2404:6800:400a:1001::64, AAAA 2404:6800:400a:1001::71, AAAA 2404:6800:400a:1001::65 (140)
```

And if I add anycast  IP to the "DNS Server Local End Points"  according to the [https://github.com/TechnitiumSoftware/DnsServer/issues/1742](url) so it doesn't work now as a solution

**Comment by ShreyasZare** [comment]
Thanks everyone for the feedback. The issue has been fixed in the development code and an update will be available very soon. A couple of more issues were reported so getting them fixed too with this update. Will let you all know when the update is available.

**Comment by NebulaMods** [comment]
Also experiencing this issue, thankfully upgraded my homelab instance, before upgrading my production instance lol. Hope the fix is released soon, keep up the good work.

**Comment by prenetic** [comment]
> And if I add anycast IP to the "DNS Server Local End Points" according to the [https://github.com/TechnitiumSoftware/DnsServer/issues/1742](url) so it doesn't work now as a solution

Interesting, that's what actually got me back up and running (good thing I remembered back when this entry was a requirement). I use dummy interfaces for anycast and noticed something was wrong when the QPS increased tenfold and started getting all sorts of alarms on my phone. Requests were getting in but not making their way back out.

<img width="1441" height="168" alt="Image" src="https://github.com/user-attachments/assets/fcb9a093-0e62-4fb2-8d24-843a1659ed76" />

```
3: anycast-dns: <BROADCAST,NOARP,UP,LOWER_UP> mtu 1500 qdisc noqueue state UNKNOWN group default qlen 1000
    link/ether f2:f0:2d:13:f6:b6 brd ff:ff:ff:ff:ff:ff
    inet 10.75.75.54/32 scope global anycast-dns
       valid_lft forever preferred_lft forever
    inet6 fe80::f0f0:2dff:fe13:f6b6/64 scope link
       valid_lft forever preferred_lft forever
```

<img width="867" height="419" alt="Image" src="https://github.com/user-attachments/assets/32b07fab-580a-4feb-972d-1afb1674d22a" />

Curiously, after adding the "DNS Server Local End Points" entry and a full server reboot:

```
$ sudo ss -tunlp | grep -i 53
[sudo] password for mcoppola:
udp   UNCONN 0      0         0.0.0.0%eth0:49153      0.0.0.0:*    users:(("bfdd",pid=1192,fd=24))
udp   UNCONN 0      0      10.75.2.24%eth0:53         0.0.0.0:*    users:(("dotnet",pid=1218,fd=284))
udp   UNCONN 0      0         127.0.0.1%lo:53         0.0.0.0:*    users:(("dotnet",pid=1218,fd=278))
udp   UNCONN 0      0          10.75.75.54:53         0.0.0.0:*    users:(("dotnet",pid=1218,fd=275))
udp   UNCONN 0      0              0.0.0.0:53         0.0.0.0:*    users:(("dotnet",pid=1218,fd=269))
udp   UNCONN 0      0                 [::]:53            [::]:*    users:(("dotnet",pid=1218,fd=273))
tcp   LISTEN 0      100        10.75.75.54:53         0.0.0.0:*    users:(("dotnet",pid=1218,fd=276))
tcp   LISTEN 0      100            0.0.0.0:53         0.0.0.0:*    users:(("dotnet",pid=1218,fd=272))
tcp   LISTEN 0      512                  *:5380             *:*    users:(("dotnet",pid=1218,fd=267))
tcp   LISTEN 0      100               [::]:53            [::]:*    users:(("dotnet",pid=1218,fd=274))
tcp   LISTEN 0      512                  *:53443            *:*    users:(("dotnet",pid=1218,fd=268))
```

And then after dropping and re-adding the "DNS Server Local End Points" entry while the server is running:

```
$ sudo ss -tunlp | grep -i 53
udp   UNCONN 0      0                 0.0.0.0%eth0:49153      0.0.0.0:*    users:(("bfdd",pid=1177,fd=24))
udp   UNCONN 0      0                 127.0.0.1%lo:53         0.0.0.0:*    users:(("dotnet",pid=1205,fd=276))
udp   UNCONN 0      0      10.75.75.54%anycast-dns:53         0.0.0.0:*    users:(("dotnet",pid=1205,fd=274))
udp   UNCONN 0      0                      0.0.0.0:53         0.0.0.0:*    users:(("dotnet",pid=1205,fd=128))
udp   UNCONN 0      0                         [::]:53            [::]:*    users:(("dotnet",pid=1205,fd=272))
tcp   LISTEN 0      100                    0.0.0.0:53         0.0.0.0:*    users:(("dotnet",pid=1205,fd=269))
tcp   LISTEN 0      100                10.75.75.54:53         0.0.0.0:*    users:(("dotnet",pid=1205,fd=275))
tcp   LISTEN 0      3                    127.0.0.1:2604       0.0.0.0:*    users:(("ospfd",pid=1153,fd=13))
tcp   LISTEN 0      100                       [::]:53            [::]:*    users:(("dotnet",pid=1205,fd=273))
tcp   LISTEN 0      512                          *:53443            *:*    users:(("dotnet",pid=1205,fd=268))
tcp   LISTEN 0      512                          *:5380             *:*    users:(("dotnet",pid=1205,fd=267))
```

It looks like the binding changes, from `10.75.75.54:53` to `10.75.75.54%anycast-dns:53`.

**Comment by ShreyasZare** [comment]
Technitium DNS Server v15.4 is now available and fixes this issue. Do update and let me know your feedback.

**Comment by prenetic** [comment]
Thanks @ShreyasZare -- does this also mean we can once again omit the anycast address and instead rely on 0.0.0.0 / :: bindings?

**Comment by ShreyasZare** [comment]
@prenetic Thanks for asking, this update will work just like how it was prior to the v15.3 release. So you can just revert to your previous config and it will work.

**Comment by micush** [comment]
It's fixed. Thanks a lot. :)

**Comment by ShreyasZare** [comment]
@micush Thanks for the feedback :)

**Comment by tjfholdings** [comment]
Following up as requested: **15.4 fixes this for our anycast deployment.** Upgraded the same authoritative anycast pair (Ubuntu 24.04, install script) from 15.2 → 15.4 today, rolling with each node drained from BGP during its upgrade.

On 15.4 the per-IP UDP sockets are no longer device-bound — `ss -ulnp` shows the pre-15.3 form again (no `%dummy0`):

```
UNCONN 0 0 142.248.192.53:53 0.0.0.0:* users:(("dotnet",...))
```

Verified the reply path end-to-end on both nodes, both address families:
- on-link test with the neighbor entry pinned to a specific node's NIC (the exact path that blackholed on 15.3): replies now egress the correct interface, queries answer normally;
- routed/BGP path tested from the upstream routers against the anycast IPs (IPv4 + IPv6): answers normally.

Also repeated the socket inspection and query test after a full `systemctl restart dns` on a drained node (re: the bind-timing report above) — sockets came up clean and the anycast IP answered on the first try.

Thanks for the quick turnaround on this one.

**Comment by prenetic** [comment]
Also verifying here, I removed the explicit binding for anycast and the cluster is functioning again on 15.4.

**Comment by ShreyasZare** [comment]
@tjfholdings @prenetic thanks for the feedback.
