### ISSUE TITLE
DNS Client -> This Server (this-server) works with DNS-over-TCP but not DNS-over-UDP in 15.4 when using VRFs

### ISSUE THREAD

**Issue by Apachez-** [TechnitiumSoftware/DnsServer#2039]
Version 15.4 fixed some issues regarding selecting device or VRF for "DNS Server Local End Points" which is handy if you use VRFs.

However I assume since neither DNS Server IPV4 Source Addresses or DNS Server IPv6 Source Addresses allows the new syntax of %VRF this means that DNS-over-TCP works with the builtin DNS Client but not DNS-over-UDP.

Current settings:

Settings -> General -> DNS Server Local End Points: 192.168.1.20%PROD:53
Settings -> General -> DNS Server IPv4 Source Addresses: 192.168.1.20
Settings -> General -> DNS Server IPv6 Source Addresses: ::

Above works for incoming DNS queries both regarding DNS-over-UDP and DNS-over-TCP (verified with "dig @192.168.1.20 localhost" aswell as "dig @192.168.1.20 +tcp localhost").

But when using DNS Client through the webgui with "Server" set to "This Server (this-server)" then egressing DNS-over-TCP works but not DNS-over-UDP who gets timeout:

> Error! DnsClient failed to resolve the request 'ping.sunet.se. A IN': request timed out for name server [vyos1.example.com (192.168.1.20)]. Connection timed out

Nothing obvious is seen in the log even with stack trace enabled.

Doing a tcpdump I do see the requests leaving and returning to the interface but then nothing:

14:24:29.727360 IP 192.168.1.20.55410 > 192.168.1.20.domain: 62546+ [1au] A? ping.sunet.se. (42)
14:24:29.727956 IP 192.168.1.20.domain > 192.168.1.20.55410: 62546 1/0/1 A 192.36.125.18 (58)
14:24:39.728945 IP 192.168.1.20.52958 > 192.168.1.20.domain: 62546+ A? ping.sunet.se. (31)
14:24:39.729508 IP 192.168.1.20.domain > 192.168.1.20.52958: 62546 1/0/0 A 192.36.125.18 (47)

I also see several "ICMP 192.168.1.20 udp port <high number> unreachable" being sent by 192.168.1.20 back to external DNS servers?

**Comment by Apachez-** [comment]
Changing "DNS Server Local End Points" from "192.168.1.20%PROD:53" to "192.168.1.20%eth1:53" gives the same result regarding "DNS Client".

"DNS Server IPv4 Source Addresses" remained at "192.168.1.20".

That is DNS-over-TCP works but not DNS-over-UDP:

> Error! DnsClient failed to resolve the request 'ping.sunet.se. A IN': request timed out for name server [vyos1.example.com (192.168.1.20)]. Connection timed out

I also tried changing "DNS Server IPv4 Source Addresses" to "0.0.0.0" but now getting:

> Error! Network is unreachable

Edit:

I can add that changing from "This Server (this-server)" to these (as example) works for both DNS-over-UDP and DNS-over-TCP:

- 192.168.1.20
- 8.8.8.8
- 1.1.1.1
- Recursive Query (recursive-resolver)

But when using "This Server (this-server)" only DNS-over-TCP works while DNS-over-UDP timeouts.

**Comment by ShreyasZare** [comment]
Thanks for the feedback. Will investigate this and let you know soon.

**Comment by ShreyasZare** [comment]
> Settings -> General -> DNS Server Local End Points: 192.168.1.20%PROD:53

Is that the only local end point configured? If yes then I would suggest that you add `127.0.0.1` and/or `0.0.0.0` in there and see if that makes any difference. Try with the source address option set to `0.0.0.0` too.

> Settings -> General -> DNS Server IPv4 Source Addresses: 192.168.1.20

Does your scenario really require using source address? 

Just clarifying here that the source address option is not used with the DNS service itself. That is, the inbound request that are answered back do not use the source address feature. The response are sent back using the same socket from where the request was received on.

The source address option is used only for recursive resolution and forwarding. Since this is a global option, it affects the DNS Client code too and the sockets it use for resolving queries.

**Comment by Apachez-** [comment]
1) I will try and get back with results. 0.0.0.0 is however not an option for me since Im using VRFs. I want the DNS-server to only use VRF PROD and not VRF MGMT for incoming AND outgoing DNS-traffic.

2) See above. I want to lock technitium/dns-server to only use interfaces which belongs to VRF PROD. It should never use VRF MGMT for incoming or outgoing traffic.

**Comment by Apachez-** [comment]
Adding "0.0.0.0" to "DNS Server IPv4 Source Addresses" like so:

```
192.168.1.20
0.0.0.0
```

Didnt change anything, DNS-over-TCP works but DNS-over-UDP doesnt.

So I tried this instead:

```
192.168.1.20
127.0.0.1
```

Same result.

It also failed no matter if I used this as "DNS Server Local End Points":

```
192.168.1.20%PROD:53
```

Or added to listen at 127.0.0.1:

```
192.168.1.20%PROD:53
127.0.0.1:53
```

Here is output from DNS-client when it do work using DNS-over-TCP:

```
{
  "Metadata": {
    "NameServer": "vyos1.example.com (192.168.1.20)",
    "Protocol": "Tcp",
    "DatagramSize": "58 bytes",
    "RoundTripTime": "1.08 ms"
  },
  "EDNS": {
    "UdpPayloadSize": 1232,
    "ExtendedRCODE": "NoError",
    "Version": 0,
    "Flags": "None",
    "Options": []
  },
  "Identifier": 0,
  "IsResponse": true,
  "OPCODE": "StandardQuery",
  "AuthoritativeAnswer": false,
  "Truncation": false,
  "RecursionDesired": true,
  "RecursionAvailable": true,
  "Z": 0,
  "AuthenticData": false,
  "CheckingDisabled": false,
  "RCODE": "NoError",
  "QDCOUNT": 1,
  "ANCOUNT": 1,
  "NSCOUNT": 0,
  "ARCOUNT": 1,
  "Question": [
    {
      "Name": "ping.sunet.se",
      "Type": "A",
      "Class": "IN"
    }
  ],
  "Answer": [
    {
      "Name": "ping.sunet.se",
      "Type": "A",
      "Class": "IN",
      "TTL": "25668 (7h7m48s)",
      "RDLENGTH": "4 bytes",
      "RDATA": {
        "IPAddress": "192.36.125.18"
      },
      "DnssecStatus": "Disabled"
    }
  ],
  "Authority": [],
  "Additional": [
    {
      "Name": "",
      "Type": "OPT",
      "Class": "1232",
      "TTL": "0 (0s)",
      "RDLENGTH": "0 bytes",
      "RDATA": {
        "Options": []
      },
      "DnssecStatus": "Disabled"
    }
  ]
}
```

**Comment by ShreyasZare** [comment]
Thanks for the details.

> Adding "0.0.0.0" to "DNS Server IPv4 Source Addresses" like so:

There seems to be some confusion. I wanted to see if adding `0.0.0.0` to `DNS Server Local End Points` makes any difference.

The "This Server" option selects the IP end point to query based on the local end points that are configured. So, having `0.0.0.0` in there should make some difference when no source address is configured.

**Comment by Apachez-** [comment]
Yes,

Adding "0.0.0.0:53" ("192.168.1.20%PROD:53" is already present) to "DNS Server Local End Points" did make a difference.

Now both DNS-over-UDP and DNS-over-TCP works:

```
{
  "Metadata": {
    "NameServer": "vyos1.example.com (127.0.0.1)",
    "Protocol": "Udp",
    "DatagramSize": "58 bytes",
    "RoundTripTime": "1.01 ms"
  },
```

Odd thing here is that 127.0.0.1 is being used according to the output of above?

So changing "0.0.0.0:53" into "127.0.0.1:53" should work aswell but it doesnt... now TCP-over-DNS works but UDP-over-DNS doesnt!?

Using 0.0.0.0:53 as "DNS Server Local End Points" isnt really an option to me.

But perhaps might nail it down to where the error might be in the code?

I also tried this:

```
DNS Server Local End Points:

192.168.1.20%PROD:53
127.0.0.1%lo:53
127.0.0.1:53

DNS Server IPv4 Source Addresses

192.168.1.20
127.0.0.1
0.0.0.0
```

Above is confirmed by "sudo ss -atulpn | grep 53":

```
udp   UNCONN 0      0              127.0.0.1:53         0.0.0.0:*    users:(("dotnet",pid=51938,fd=285))
udp   UNCONN 0      0           127.0.0.1%lo:53         0.0.0.0:*    users:(("dotnet",pid=51938,fd=252))
udp   UNCONN 0      0      192.168.1.20%PROD:53         0.0.0.0:*    users:(("dotnet",pid=51938,fd=247))
tcp   LISTEN 0      1000           127.0.0.1:53         0.0.0.0:*    users:(("dotnet",pid=51938,fd=286))
tcp   LISTEN 0      1000           127.0.0.1:53         0.0.0.0:*    users:(("dotnet",pid=51938,fd=284))
tcp   LISTEN 0      512          10.99.0.100:53443      0.0.0.0:*    users:(("dotnet",pid=51938,fd=246))
tcp   LISTEN 0      512          10.99.0.100:5380       0.0.0.0:*    users:(("dotnet",pid=51938,fd=245))
tcp   LISTEN 0      1000        192.168.1.20:53         0.0.0.0:*    users:(("dotnet",pid=51938,fd=248))
```

Where with the original config it looks like this:

```
udp   UNCONN 0      0      192.168.1.20%PROD:53         0.0.0.0:*    users:(("dotnet",pid=51938,fd=247))
tcp   LISTEN 0      512          10.99.0.100:53443      0.0.0.0:*    users:(("dotnet",pid=51938,fd=246))
tcp   LISTEN 0      512          10.99.0.100:5380       0.0.0.0:*    users:(("dotnet",pid=51938,fd=245))
tcp   LISTEN 0      1000        192.168.1.20:53         0.0.0.0:*    users:(("dotnet",pid=51938,fd=248))
```

It only seems to be working when adding "0.0.0.0:53" to "DNS Server Local End Points" no matter what the other values are in both "DNS Server Local End Points" and "DNS Server IPv4 Source Addresses".

Which then outputs this from the DNS client for DNS-over-UDP:

```
{
  "Metadata": {
    "NameServer": "vyos1.example.com (127.0.0.1)",
    "Protocol": "Udp",
    "DatagramSize": "54 bytes",
    "RoundTripTime": "0.54 ms"
  },
```

**Comment by ShreyasZare** [comment]
Thanks for the feedback. I think you can try the following values in the given order for DNS Server Local End Points and it should work:

DNS Server Local End Points:
```
127.0.0.1:53
192.168.1.20%PROD:53
```

The "This Server" code is picking up the first entry if it does not find `0.0.0.0` or `::` in there. Will get that code updated so that the above order to have loopback as the first entry is not necessary to maintain.

**Comment by Apachez-** [comment]
I tried both ("DNS Server Local End Points"):

```
127.0.0.1:53
192.168.1.20%PROD:53
```

and

```
127.0.0.1%lo:53
192.168.1.20%PROD:53
```

Still DNS-over-TCP works (says its using `"NameServer": "vyos1.example.com (127.0.0.1)",` according to the response log?) while DNS-over-UDP timeout.

Replacing `127.0.0.1:53` with `0.0.0.0:53` will make DNS-over-UDP work however it will still say that it is using `127.0.0.1` in the response log?

If I remove 127.0.0.1 and 0.0.0.0 so it will only be (as I began with) just "192.168.1.20%PROD:53" the DNS-over-TCP works but DNS-over-UDP fails. The response log for DNS-over-TCP (which works) now says its using "192.168.1.20" instead of "127.0.0.1".

However when I in DNS-client change "Server" from "This Server {this-server}" to "192.168.1.20" then both DNS-over-TCP and DNS-over-UDP works.

So the order I write "DNS Server Local End Points" doesnt seem to matter?

Summary (DNS-over-TCP works all the time its DNS-over-UDP that timeout):

DNS-client Server set to "This Server {this-server}":

Works (order doesnt seem to matter):

```
0.0.0.0:53
192.168.1.20%PROD:53
```

Does not work:

```
192.168.1.20%PROD:53
```

```
127.0.0.1:53
192.168.1.20%PROD:53
```

```
127.0.0.1%lo:53
192.168.1.20%PROD:53
```

DNS-client Server set to "127.0.0.1":

Works:

```
127.0.0.1:53
192.168.1.20%PROD:53
```

```
127.0.0.1%lo:53
192.168.1.20%PROD:53
```

DNS-client Server set to "192.168.1.20":

Works:

```
192.168.1.20%PROD:53
```

So it seems that whatever "This Server {this-server}" is doing is what malfunctions when you have VRFs configured because specifying "192.168.1.20" (or "127.0.0.1" when configured)  works as "Server" even when VRFs are being used?

**Comment by ShreyasZare** [comment]
[This is how](https://github.com/TechnitiumSoftware/DnsServer/blob/master/DnsServerCore/Dns/DnsServer.cs#L6352-L6370) the "This Server" address is updated by the DNS server. If ANY addresses are not found, it uses the first entry in the local end point config.

So, the below DNS Server Local End Point config should have worked:
```
127.0.0.1:53
192.168.1.20%PROD:53
```

Not really sure what could be happening.

**Comment by Apachez-** [comment]
Yeah thats why I tested with both "127.0.0.1:53" and "127.0.0.1%lo:53" since VRF or interface shouldnt really matter for localhost.

Also since the response log says that when DNS-over-TCP is being used which do work (and I have your suggested 2-line config) it does use 127.0.0.1 as target but fails when I go for DNS-over-UDP.

And when I manually type in "127.0.0.1" (instead of "This Server {this-server}") then it will work for both DNS-over-TCP and DNS-over-UDP.

Looking at the forwarding tables (id:100 is MGMT and id:101 is PROD and Local is "default" when no vrf is selected) we can see that 127.0.0.0/8 do exist for all variants (below is from within the container):

```
# cat /proc/net/fib_trie
Id 100:
  +-- 0.0.0.0/1 2 0 2
     +-- 10.99.0.0/24 2 0 1
        |-- 10.99.0.0
           /24 link UNICAST
        |-- 10.99.0.100
           /32 host LOCAL
        |-- 10.99.0.255
           /32 link BROADCAST
     +-- 127.0.0.0/8 2 0 2
        +-- 127.0.0.0/31 1 0 0
           |-- 127.0.0.0
              /8 link UNICAST
           |-- 127.0.0.1
              /32 host LOCAL
        |-- 127.255.255.255
           /32 link BROADCAST
Id 101:
  +-- 0.0.0.0/0 3 0 5
     |-- 0.0.0.0
        /0 universe UNICAST
     +-- 127.0.0.0/8 2 0 2
        +-- 127.0.0.0/31 1 0 0
           |-- 127.0.0.0
              /8 link UNICAST
           |-- 127.0.0.1
              /32 host LOCAL
        |-- 127.255.255.255
           /32 link BROADCAST
     +-- 192.168.1.0/24 2 0 2
        +-- 192.168.1.0/27 2 0 2
           |-- 192.168.1.0
              /24 link UNICAST
           |-- 192.168.1.20
              /32 host LOCAL
        |-- 192.168.1.255
           /32 link BROADCAST
Local:
  +-- 127.0.0.0/8 2 0 2
     +-- 127.0.0.0/31 1 0 0
        |-- 127.0.0.0
           /8 host LOCAL
        |-- 127.0.0.1
           /32 host LOCAL
     |-- 127.255.255.255
        /32 link BROADCAST
```

Also confirmed by doing "ip route show vrf <name>" at the host:

```
# ip route show vrf MGMT
10.99.0.0/24 dev eth0 proto kernel scope link src 10.99.0.100 
127.0.0.0/8 dev MGMT proto kernel scope link src 127.0.0.1 

# ip route show vrf PROD
default nhid 20 via 192.168.1.254 dev eth1 proto static metric 20 
127.0.0.0/8 dev PROD proto kernel scope link src 127.0.0.1 
192.168.1.0/24 dev eth1 proto kernel scope link src 192.168.1.20 
```

Other than enabling stack trace for logging - are there any other debug I can add to the code and make a custom compile to better help you find out where its going wrong for the DNS-client?

**Comment by Apachez-** [comment]
So I tried this:

Added this custom debug (write to console) at beginning of UpdateThisServer() function like so:

```
        private void UpdateThisServer() 
        {
            foreach (var ep in _localEndPoints) 
            {
                Console.WriteLine(
                    $"DEBUG: " +
                    $"{ep.Address}:{ep.Port}, " +
                    $"IsAny={ep.Address.Equals(IPAddress.Any)}, " +
                    $"IsIPv6Any={ep.Address.Equals(IPAddress.IPv6Any)}");
            }
```

Recompiled and replaced official 15.4.0 with this custom edition.

Went to Settings -> General and set "DNS Server Local End Points" to:

```
127.0.0.1:53
192.168.1.20%PROD:53
```

Then saved config and first attempted a DNS-over-TCP in DNS-client where server is "This Server {this-server}" - this worked.

Then changed to DNS-over-UDP and it timeout...

This is what I got in console (stack trace being disabled):

```
Jul 15 15:23:56 vyos dns[13938]: [2026-07-15 13:23:56 Local] [10.99.0.10:54422] Check for update was done {dnsServerEnableCheckForUpdate: False; updateAvailable: False;}
Jul 15 15:24:07 vyos dns[13938]: [2026-07-15 13:24:07 Local] Web Service TLS certificate was loaded: /etc/dns/self-signed-cert.pfx
Jul 15 15:24:07 vyos dns[13938]: [2026-07-15 13:24:07 Local] [10.99.0.10:54422] [admin] DNS Settings were updated successfully.
Jul 15 15:24:07 vyos dns[13938]: [2026-07-15 13:24:07 Local] Attempting to restart DNS service.
Jul 15 15:24:07 vyos dns[13938]: DEBUG: 127.0.0.1:53, IsAny=False, IsIPv6Any=False
Jul 15 15:24:07 vyos dns[13938]: DEBUG: 192.168.1.20:53, IsAny=False, IsIPv6Any=False
Jul 15 15:24:07 vyos dns[13938]: [2026-07-15 13:24:07 Local] [127.0.0.1:53] [UDP] DNS Server was bound successfully.
Jul 15 15:24:07 vyos dns[13938]: [2026-07-15 13:24:07 Local] [127.0.0.1:53] [TCP] DNS Server was bound successfully.
Jul 15 15:24:07 vyos dns[13938]: [2026-07-15 13:24:07 Local] [192.168.1.20%PROD:53] [UDP] Socket was bound to device 'PROD' successfully.
Jul 15 15:24:07 vyos dns[13938]: [2026-07-15 13:24:07 Local] [192.168.1.20%PROD:53] [UDP] DNS Server was bound successfully.
Jul 15 15:24:07 vyos dns[13938]: [2026-07-15 13:24:07 Local] [192.168.1.20%PROD:53] [TCP] DNS Server was bound successfully.
Jul 15 15:24:07 vyos dns[13938]: [2026-07-15 13:24:07 Local] DNS service was restarted successfully.
Jul 15 15:24:12 vyos dns[13938]: [2026-07-15 13:24:12 Local] DNS Server block list config file was saved: /etc/dns/blocklist.config
Jul 15 15:24:12 vyos dns[13938]: [2026-07-15 13:24:12 Local] DNS Server log config file was saved: /etc/dns/log.config
Jul 15 15:24:12 vyos dns[13938]: [2026-07-15 13:24:12 Local] Web Service config file was saved: /etc/dns/webservice.config
Jul 15 15:24:12 vyos dns[13938]: [2026-07-15 13:24:12 Local] DNS Server config file was saved: /etc/dns/dns.config
Jul 15 15:24:42 vyos dns[13938]: [2026-07-15 13:24:42 Local] [10.99.0.10:54422] DnsClient failed to resolve the request 'ping.sunet.se. A IN': request timed out for name server [vyos1.example.com (127.0.0.1)].
```

The "10.99.0.10:54422" seen above is the MGMT-client I use to connect to the webgui.

Any suggestions on how to dump more data to help you figure out where it goes wrong?

Edit:

I redid DNS-over-UDP where server is "This Server {this-server}" with stack trace enabled:

```
Jul 15 15:34:08 vyos dns[13938]: [2026-07-15 13:34:08 Local] [10.99.0.10:59540] TechnitiumLibrary.Net.Dns.DnsClientNoResponseException: DnsClient failed to resolve the request 'ping.sunet.se. A IN': request timed out for name server [vyos1.example.com (127.0.0.1)].
Jul 15 15:34:08 vyos dns[13938]:  ---> System.Net.Sockets.SocketException (110): Connection timed out
Jul 15 15:34:08 vyos dns[13938]:    at TechnitiumLibrary.Net.SocketExtensions.UdpQueryAsync(Socket socket, ArraySegment`1 request, ArraySegment`1 response, IPEndPoint remoteEP, Int32 timeout, Int32 retries, Boolean expBackoffTimeout, Func`2 isResponseValid, CancellationToken cancellationToken) in Z:\Technitium\Projects\TechnitiumLibrary\TechnitiumLibrary.Net\SocketExtensions.cs:line 141
Jul 15 15:34:08 vyos dns[13938]:    at TechnitiumLibrary.Net.Dns.ClientConnection.UdpClientConnection.QueryAsync(DnsDatagram request, Int32 timeout, Int32 retries, CancellationToken cancellationToken) in Z:\Technitium\Projects\TechnitiumLibrary\TechnitiumLibrary.Net\Dns\ClientConnection\UdpClientConnection.cs:line 330
Jul 15 15:34:08 vyos dns[13938]:    --- End of inner exception stack trace ---
Jul 15 15:34:08 vyos dns[13938]:    at TechnitiumLibrary.Net.Dns.ClientConnection.UdpClientConnection.QueryAsync(DnsDatagram request, Int32 timeout, Int32 retries, CancellationToken cancellationToken) in Z:\Technitium\Projects\TechnitiumLibrary\TechnitiumLibrary.Net\Dns\ClientConnection\UdpClientConnection.cs:line 339
Jul 15 15:34:08 vyos dns[13938]:    at TechnitiumLibrary.Net.Dns.DnsClient.<>c__DisplayClass89_0.<<InternalResolveAsync>g__DoResolveAsync|1>d.MoveNext() in Z:\Technitium\Projects\TechnitiumLibrary\TechnitiumLibrary.Net\Dns\DnsClient.cs:line 4566
Jul 15 15:34:08 vyos dns[13938]: --- End of stack trace from previous location ---
Jul 15 15:34:08 vyos dns[13938]:    at TechnitiumLibrary.Net.Dns.DnsClient.<>c__DisplayClass89_0.<<InternalResolveAsync>g__DoResolveAsync|1>d.MoveNext() in Z:\Technitium\Projects\TechnitiumLibrary\TechnitiumLibrary.Net\Dns\DnsClient.cs:line 4792
Jul 15 15:34:08 vyos dns[13938]: --- End of stack trace from previous location ---
Jul 15 15:34:08 vyos dns[13938]:    at TechnitiumLibrary.Net.Dns.DnsClient.<>c__DisplayClass89_0.<<InternalResolveAsync>g__DoResolveAsync|1>d.MoveNext() in Z:\Technitium\Projects\TechnitiumLibrary\TechnitiumLibrary.Net\Dns\DnsClient.cs:line 4482
Jul 15 15:34:08 vyos dns[13938]: --- End of stack trace from previous location ---
Jul 15 15:34:08 vyos dns[13938]:    at TechnitiumLibrary.Net.Dns.DnsClient.InternalResolveAsync(DnsDatagram request, Func`3 getValidatedResponseAsync, Boolean doNotReorderNameServers, CancellationToken cancellationToken) in Z:\Technitium\Projects\TechnitiumLibrary\TechnitiumLibrary.Net\Dns\DnsClient.cs:line 4954
Jul 15 15:34:08 vyos dns[13938]:    at TechnitiumLibrary.Net.Dns.DnsClient.InternalNoDnssecResolveAsync(DnsDatagram request, CancellationToken cancellationToken) in Z:\Technitium\Projects\TechnitiumLibrary\TechnitiumLibrary.Net\Dns\DnsClient.cs:line 4973
Jul 15 15:34:08 vyos dns[13938]:    at DnsServerCore.DnsWebService.WebServiceApi.ResolveQueryAsync(HttpContext context) in /src/DnsServer/DnsServerCore/WebServiceApi.cs:line 312
Jul 15 15:34:08 vyos dns[13938]:    at DnsServerCore.DnsWebService.WebServiceApiMiddleware(HttpContext context, RequestDelegate next) in /src/DnsServer/DnsServerCore/DnsWebService.cs:line 2465
Jul 15 15:34:08 vyos dns[13938]:    at Microsoft.AspNetCore.Diagnostics.ExceptionHandlerMiddlewareImpl.<Invoke>g__Awaited|10_0(ExceptionHandlerMiddlewareImpl middleware, HttpContext context, Task task)
```

**Comment by Apachez-** [comment]
An observation:

When using:

```
127.0.0.1:53
192.168.1.20%PROD:53
```

And saving config and then try the DNS-over-UDP with DNS-client (server: "This Server {this-server}") I get this in log:

```
Jul 15 15:41:55 vyos dns[13938]: [2026-07-15 13:41:55 Local] Web Service TLS certificate was loaded: /etc/dns/self-signed-cert.pfx
Jul 15 15:41:55 vyos dns[13938]: [2026-07-15 13:41:55 Local] [10.99.0.10:59002] [admin] DNS Settings were updated successfully.
Jul 15 15:41:55 vyos dns[13938]: [2026-07-15 13:41:55 Local] Attempting to restart DNS service.
Jul 15 15:41:55 vyos dns[13938]: [2026-07-15 13:41:55 Local] [127.0.0.1:53] [UDP] DNS Server was bound successfully.
Jul 15 15:41:55 vyos dns[13938]: [2026-07-15 13:41:55 Local] [127.0.0.1:53] [TCP] DNS Server was bound successfully.
Jul 15 15:41:55 vyos dns[13938]: [2026-07-15 13:41:55 Local] [192.168.1.20%PROD:53] [UDP] Socket was bound to device 'PROD' successfully.
Jul 15 15:41:55 vyos dns[13938]: [2026-07-15 13:41:55 Local] [192.168.1.20%PROD:53] [UDP] DNS Server was bound successfully.
Jul 15 15:41:55 vyos dns[13938]: [2026-07-15 13:41:55 Local] [192.168.1.20%PROD:53] [TCP] DNS Server was bound successfully.
Jul 15 15:41:55 vyos dns[13938]: DEBUG: 127.0.0.1:53, IsAny=False, IsIPv6Any=False
Jul 15 15:41:55 vyos dns[13938]: DEBUG: 192.168.1.20:53, IsAny=False, IsIPv6Any=False
Jul 15 15:41:55 vyos dns[13938]: [2026-07-15 13:41:55 Local] DNS service was restarted successfully.
Jul 15 15:42:00 vyos dns[13938]: [2026-07-15 13:42:00 Local] DNS Server block list config file was saved: /etc/dns/blocklist.config
Jul 15 15:42:00 vyos dns[13938]: [2026-07-15 13:42:00 Local] Web Service config file was saved: /etc/dns/webservice.config
Jul 15 15:42:00 vyos dns[13938]: [2026-07-15 13:42:00 Local] DNS Server log config file was saved: /etc/dns/log.config
Jul 15 15:42:00 vyos dns[13938]: [2026-07-15 13:42:00 Local] DNS Server config file was saved: /etc/dns/dns.config

Jul 15 15:42:21 vyos dns[13938]: [2026-07-15 13:42:21 Local] [10.99.0.10:59002] DnsClient failed to resolve the request 'ping.sunet.se. A IN': request timed out for name server [vyos1.example.com (127.0.0.1)].
```

That last line shows up when the timeout occurs (getting that red box popup in webgui that the query failed).

However when I use this:

```
0.0.0.0:53
192.168.1.20%PROD:53
```

This is seen in the log when saving config:

```
Jul 15 15:44:00 vyos dns[13938]: [2026-07-15 13:44:00 Local] Web Service TLS certificate was loaded: /etc/dns/self-signed-cert.pfx
Jul 15 15:44:00 vyos dns[13938]: [2026-07-15 13:44:00 Local] [10.99.0.10:59002] [admin] DNS Settings were updated successfully.
Jul 15 15:44:00 vyos dns[13938]: [2026-07-15 13:44:00 Local] Attempting to restart DNS service.
Jul 15 15:44:00 vyos dns[13938]: DEBUG: 0.0.0.0:53, IsAny=True, IsIPv6Any=False
Jul 15 15:44:00 vyos dns[13938]: DEBUG: 192.168.1.20:53, IsAny=False, IsIPv6Any=False
Jul 15 15:44:00 vyos dns[13938]: [2026-07-15 13:44:00 Local] [0.0.0.0:53] [UDP] DNS Server was bound successfully.
Jul 15 15:44:00 vyos dns[13938]: [2026-07-15 13:44:00 Local] [0.0.0.0:53] [TCP] DNS Server was bound successfully.
Jul 15 15:44:00 vyos dns[13938]: [2026-07-15 13:44:00 Local] [192.168.1.20%PROD:53] [UDP] Socket was bound to device 'PROD' successfully.
Jul 15 15:44:00 vyos dns[13938]: [2026-07-15 13:44:00 Local] [192.168.1.20%PROD:53] [UDP] DNS Server was bound successfully.
Jul 15 15:44:00 vyos dns[13938]: [2026-07-15 13:44:00 Local] [192.168.1.20%PROD:53] [TCP] DNS Server was bound successfully.
Jul 15 15:44:00 vyos dns[13938]: [2026-07-15 13:44:00 Local] DNS service was restarted successfully.
Jul 15 15:44:04 vyos dns[13938]: [2026-07-15 13:44:04 Local] DNS Server block list config file was saved: /etc/dns/blocklist.config
Jul 15 15:44:05 vyos dns[13938]: [2026-07-15 13:44:05 Local] Web Service config file was saved: /etc/dns/webservice.config
Jul 15 15:44:05 vyos dns[13938]: [2026-07-15 13:44:05 Local] DNS Server log config file was saved: /etc/dns/log.config
Jul 15 15:44:05 vyos dns[13938]: [2026-07-15 13:44:05 Local] DNS Server config file was saved: /etc/dns/dns.config
```

But then this line shows up when I click on Resolve in DNS-client:

```
Jul 15 15:44:12 vyos dns[13938]: [2026-07-15 13:44:12 Local] [127.0.0.1:53] [UDP] DNS Server was bound successfully.
```

Its like when 127.0.0.1 is not part of "DNS Server Local End Points" it will bind late and then working. But when its part of "DNS Server Local End Points" it binds early and fails for UDP?

Where (and why) does this late bind come from in the code?

**Comment by Apachez-** [comment]
Doing some more debugging.

When using:

```
127.0.0.1:53
192.168.1.20%PROD:53
```

I get:

```
Jul 15 17:25:18 vyos dns[17119]: DEBUG: ---- InterfaceEndPoint ----
Jul 15 17:25:18 vyos dns[17119]: InterfaceName = 
Jul 15 17:25:18 vyos dns[17119]: AddressFamily = InterNetwork
Jul 15 17:25:18 vyos dns[17119]: Address = 127.0.0.1
Jul 15 17:25:18 vyos dns[17119]: Port = 53
Jul 15 17:25:18 vyos dns[17119]: _interfaceName = 
Jul 15 17:25:18 vyos dns[17119]: 
Jul 15 17:25:18 vyos dns[17119]: DEBUG: ---- InterfaceEndPoint ----
Jul 15 17:25:18 vyos dns[17119]: InterfaceName = PROD
Jul 15 17:25:18 vyos dns[17119]: AddressFamily = InterNetwork
Jul 15 17:25:18 vyos dns[17119]: Address = 192.168.1.20
Jul 15 17:25:18 vyos dns[17119]: Port = 53
Jul 15 17:25:18 vyos dns[17119]: _interfaceName = PROD
Jul 15 17:25:18 vyos dns[17119]: 
Jul 15 17:25:18 vyos dns[17119]: DEBUG: NO HIT USING _localEndPoints[0]
Jul 15 17:25:18 vyos dns[17119]: DEBUG: ---- NameServerAddress ----
Jul 15 17:25:18 vyos dns[17119]: Protocol = Udp
Jul 15 17:25:18 vyos dns[17119]: OriginalAddress = vyos1.example.com (127.0.0.1:53)
Jul 15 17:25:18 vyos dns[17119]: IsDefaultPort = True
Jul 15 17:25:18 vyos dns[17119]: Host = vyos1.example.com
Jul 15 17:25:18 vyos dns[17119]: Port = 53
Jul 15 17:25:18 vyos dns[17119]: DoHEndPoint = 
Jul 15 17:25:18 vyos dns[17119]: DomainEndPoint = vyos1.example.com:53
Jul 15 17:25:18 vyos dns[17119]: IPEndPoint = 127.0.0.1:53
Jul 15 17:25:18 vyos dns[17119]: EndPoint = 127.0.0.1:53
Jul 15 17:25:18 vyos dns[17119]: IsIPEndPointStale = False
Jul 15 17:25:18 vyos dns[17119]: Metadata = TechnitiumLibrary.Net.Dns.NameServerMetadata
Jul 15 17:25:18 vyos dns[17119]: _protocol = Udp
Jul 15 17:25:18 vyos dns[17119]: _originalAddress = vyos1.example.com (127.0.0.1:53)
Jul 15 17:25:18 vyos dns[17119]: _dohEndPoint = 
Jul 15 17:25:18 vyos dns[17119]: _domainEndPoint = vyos1.example.com:53
Jul 15 17:25:18 vyos dns[17119]: _ipEndPoint = 127.0.0.1:53
Jul 15 17:25:18 vyos dns[17119]: _ipEndPointExpires = False
Jul 15 17:25:18 vyos dns[17119]: _ipEndPointExpiresOn = 01/01/0001 00:00:00
Jul 15 17:25:18 vyos dns[17119]: _metadata = TechnitiumLibrary.Net.Dns.NameServerMetadata
```

And when using:

```
0.0.0.0:53
192.168.1.20%PROD:53
```

Im getting:

```
Jul 15 17:27:43 vyos dns[17119]: DEBUG: ---- InterfaceEndPoint ----
Jul 15 17:27:43 vyos dns[17119]: InterfaceName = 
Jul 15 17:27:43 vyos dns[17119]: AddressFamily = InterNetwork
Jul 15 17:27:43 vyos dns[17119]: Address = 0.0.0.0
Jul 15 17:27:43 vyos dns[17119]: Port = 53
Jul 15 17:27:43 vyos dns[17119]: _interfaceName = 
Jul 15 17:27:43 vyos dns[17119]: 
Jul 15 17:27:43 vyos dns[17119]: DEBUG: HIT IPAddress.Any
Jul 15 17:27:43 vyos dns[17119]: DEBUG: ---- NameServerAddress ----
Jul 15 17:27:43 vyos dns[17119]: Protocol = Udp
Jul 15 17:27:43 vyos dns[17119]: OriginalAddress = vyos1.example.com (127.0.0.1:53)
Jul 15 17:27:43 vyos dns[17119]: IsDefaultPort = True
Jul 15 17:27:43 vyos dns[17119]: Host = vyos1.example.com
Jul 15 17:27:43 vyos dns[17119]: Port = 53
Jul 15 17:27:43 vyos dns[17119]: DoHEndPoint = 
Jul 15 17:27:43 vyos dns[17119]: DomainEndPoint = vyos1.example.com:53
Jul 15 17:27:43 vyos dns[17119]: IPEndPoint = 127.0.0.1:53
Jul 15 17:27:43 vyos dns[17119]: EndPoint = 127.0.0.1:53
Jul 15 17:27:43 vyos dns[17119]: IsIPEndPointStale = False
Jul 15 17:27:43 vyos dns[17119]: Metadata = TechnitiumLibrary.Net.Dns.NameServerMetadata
Jul 15 17:27:43 vyos dns[17119]: _protocol = Udp
Jul 15 17:27:43 vyos dns[17119]: _originalAddress = vyos1.example.com (127.0.0.1:53)
Jul 15 17:27:43 vyos dns[17119]: _dohEndPoint = 
Jul 15 17:27:43 vyos dns[17119]: _domainEndPoint = vyos1.example.com:53
Jul 15 17:27:43 vyos dns[17119]: _ipEndPoint = 127.0.0.1:53
Jul 15 17:27:43 vyos dns[17119]: _ipEndPointExpires = False
Jul 15 17:27:43 vyos dns[17119]: _ipEndPointExpiresOn = 01/01/0001 00:00:00
Jul 15 17:27:43 vyos dns[17119]: _metadata = TechnitiumLibrary.Net.Dns.NameServerMetadata
```

Since NameServerAddress within UpdateThisServer() seems to be equal in both cases the error is most likely elsewhere?

**Comment by Apachez-** [comment]
It seems that the issue is at around:

https://github.com/TechnitiumSoftware/DnsServer/blob/v15.4.0/DnsServerCore/WebServiceApi.cs#L247

Because changing (quick and dirty troubleshooting so this is NOT a suggested solution) this block:

```
                            case DnsTransportProtocol.Udp:
                                nameServer = _dnsWebService._dnsServer.ThisServer;
                                break;
```

into something like:

```
                            case DnsTransportProtocol.Udp:
                                Console.WriteLine($"DEBUG: DnsTransportProtocol.Udp");
                                nameServer = _dnsWebService._dnsServer.ThisServer.Clone(DnsTransportProtocol.Udp);
                                Dump(nameServer);
                                nameServer = NameServerAddress.Parse(nameServer.IPEndPoint.ToString());
                                Dump(nameServer);
                                break;
```

Then this will start to work:

```
127.0.0.1:53
192.168.1.20%PROD:53
```

just like:

```
0.0.0.0:53
192.168.1.20%PROD:53
```

Issue however still remains with VRF/device (%device) who would log:

```
2026-07-15 16:49:46 Local] [10.99.0.10:40106] Invalid domain name [192.168.1.20%PROD]: invalid character [37] was found.
```

when "DNS Server Local End Points" is just:

```
192.168.1.20%PROD:53
```

I think proper fix is two staged:

1) Somewhere in the codepath nameServer (or such) use 0.0.0.0:53 as a specialcase where 127.0.0.1:53 would fail for this-server but not if you explictly write 127.0.0.1 as server.

2) VRF/device parsing have to be implemented also for the DNS-client codepath when UDP is being used.

**Comment by ShreyasZare** [comment]
> Its like when 127.0.0.1 is not part of "DNS Server Local End Points" it will bind late and then working. But when its part of "DNS Server Local End Points" it binds early and fails for UDP?
>
> Where (and why) does this late bind come from in the code?

If the local end point has `0.0.0.0` then the DNS server will automatically bind to the source IP address of the request that was received on the `0.0.0.0` socket. This is to ensure that the response goes out from the same interface that the request came from instead of getting routed via default route.

The way the late binding is done is exactly the same so it should work just the same. Not sure why its working differently thought.

> Because changing (quick and dirty troubleshooting so this is NOT a suggested solution) this block:

The workaround suggested does not make any difference. The original object that This Server call returns is by default set to UDP protocol. Cloning the object to change to UDP protocol really makes no difference.

**Comment by Apachez-** [comment]
The codeblock I pasted did make a change for the case with:

```
127.0.0.1:53
192.168.1.20%PROD:53
```

who previously didnt work with DNS-over-UDP but now it does.

However the change itself (again its NOT a recommended change just trying to pinpoint where it goes wrong) didnt change for the case of:

```
192.168.1.20%PROD:53
```

simply because the %device syntax doesnt seem to be implemented for that socket.

**Comment by ShreyasZare** [comment]
Thanks for the feedback. I was able to reproduce this issue and the problem is with how the End Point objects are compared when UDP response is received. Since the object is now of a different type, as the VRF changes required to use a new class derived from IPEndPoint, the comparison between the InterfaceEndPoint and IPEndPoint object is failing thus the received response is getting rejected.

Will get this issue fixed in the next update.

**Comment by ShreyasZare** [comment]
Technitium DNS Server v15.5 is now available that fixes this issue. Do update and let me know your feedback.

**Comment by Apachez-** [comment]
Using the same config as with 15.4.0 I can confirm that 15.5.0 fixed this issue.

Now both DNS-over-UDP and DNS-over-TCP works in DNS Client when default "Server: This Server {this-server}" is selected.

**Comment by ShreyasZare** [comment]
Thanks for the feedback.
