### ISSUE TITLE
Auto resync secondary zone

### ISSUE THREAD

**Issue by CRASH-Tech** [TechnitiumSoftware/DnsServer#1318]
Sometimes secondary zone failed to sync with this error
```
DnsServerCore.Dns.DnsServerException: Invalid IXFR/AXFR response was received.
   at DnsServerCore.Dns.ZoneManagers.AuthZoneManager.SyncIncrementalZoneTransferRecords(String zoneName, IReadOnlyList`1 xfrRecords) in Z:\Technitium\Projects\DnsServer\DnsServerCore\Dns\ZoneManagers\AuthZoneManager.cs:line 2035
```

It could be a network or server issue. It doesn't matter, but after that I have to manually press the resync button. How can I do it automatically? Otherwise the zone will remain in the out of sync status

**Comment by ShreyasZare** [comment]
Thanks for the post. Is the primary DNS server Technitium DNS or do you have some other software? If its Technitium DNS, what error log do you see related to the zone transfer request. The error log you see indicates that the IXFR response has some issue for sure.

**Comment by ShreyasZare** [comment]
I do not have experience working with PowerDNS but found a some what recent issue [1] which says the IXFR is not yet supported and seems to be related to the issue you are seeing.[1] https://github.com/PowerDNS/pdns/discussions/14657

**Comment by CRASH-Tech** [comment]
> I do not have experience working with PowerDNS but found a some what recent issue [1] which says the IXFR is not yet supported and seems to be related to the issue you are seeing.[1] [PowerDNS/pdns#14657](https://github.com/PowerDNS/pdns/discussions/14657)

I understand that the problem is most likely in powerdns, but Technitium DNS does not fix the problem automatically, errors continue in the log. But it is always fixed when I manually press resync. Apparently manual resync and automatic work differently.

**Comment by CRASH-Tech** [comment]
> Ya, when you use manual Resync option, the DNS server does a full zone transfers (AXFR). Whereas when it tries automatically, it does incremental zone transfer (IXFR). It will switch to AXFR if IXFR is not supported but here it seems that power dns is sending some unexpected response which is causing the operation to fail entirely instead of switching to AXFR. If possible, do run tcpdump to capture the response powerdns is sending and share it here or via email. Using that, I can try to make it work to switch to AXFR.

Yes, you can switch to AXFR if IXFR fails

**Comment by narf-** [comment]
Hi! We're having the same issue where Technitium DNS fails to refresh secondary zones after receiving a NOTIFY from PowerDNS. 

Technitium DNS version: 13.6.0 (also observed on 13.5.0)
PowerDNS Authoritative server version: 4.9.2

Technitium DNS log:


```
[2025-05-17 13:56:00 UTC] [10.50.1.11:11033] [UDP] DNS Server received a NOTIFY request for secondary zone: sub.domain.tld
[2025-05-17 13:56:05 UTC] DNS Server has started zone refresh for Secondary zone: sub.domain.tld
[2025-05-17 13:56:05 UTC] DNS Server failed to refresh 'sub.domain.tld' Secondary zone from: 10.50.1.11
DnsServerCore.Dns.DnsServerException: Invalid IXFR/AXFR response was received.
   at DnsServerCore.Dns.ZoneManagers.AuthZoneManager.SyncIncrementalZoneTransferRecords(String zoneName, IReadOnlyList`1 xfrRecords) in Z:\Technitium\Projects\DnsServer\DnsServerCore\Dns\ZoneManagers\AuthZoneManager.cs:line 2035
   at DnsServerCore.Dns.Zones.SecondaryZone.RefreshZoneAsync(IReadOnlyList`1 primaryNameServers, DnsTransportProtocol zoneTransferProtocol, TsigKey key, Boolean validateZone) in Z:\Technitium\Projects\DnsServer\DnsServerCore\Dns\Zones\SecondaryZone.cs:line 475
```



tcpdump:

```
tdns1:/opt/docker/technitium$ sudo tcpdump host 10.50.1.11
tcpdump: verbose output suppressed, use -v[v]... for full protocol decode
listening on eth0, link-type EN10MB (Ethernet), snapshot length 262144 bytes


14:05:00.037394 IP 10.50.1.11.11033 > tdns1.domain: 51176 notify [b2&3=0x2400] SOA? sub.domain.tld. (28)
14:05:00.037538 IP 10.50.1.11.11033 > tdns1.domain: 22681 notify [b2&3=0x2400] SOA? 1.1.1.in-addr.arpa. (36)
14:05:00.037973 IP tdns1.domain > 10.50.1.11.11033: 51176 notify- 0/0/0 (28)
14:05:00.038220 IP tdns1.domain > 10.50.1.11.11033: 22681 notify Refused- 0/0/0 (36)
14:05:05.038412 IP tdns1.35520 > 10.50.1.11.domain: Flags [S], seq 776048182, win 64240, options [mss 1460,sackOK,TS val 1158726251 ecr 0,nop,wscale 7], length 0
14:05:05.038836 IP 10.50.1.11.domain > tdns1.35520: Flags [S.], seq 2080943682, ack 776048183, win 65160, options [mss 1460,sackOK,TS val 382356818 ecr 1158726251,nop,wscale 7], length 0
14:05:05.038897 IP tdns1.35520 > 10.50.1.11.domain: Flags [.], ack 1, win 502, options [nop,nop,TS val 1158726251 ecr 382356818], length 0
14:05:05.039102 IP tdns1.35520 > 10.50.1.11.domain: Flags [P.], seq 1:42, ack 1, win 502, options [nop,nop,TS val 1158726251 ecr 382356818], length 41 28344 [1au] SOA? sub.domain.tld. (39)
14:05:05.039323 IP 10.50.1.11.domain > tdns1.35520: Flags [.], ack 42, win 509, options [nop,nop,TS val 382356818 ecr 1158726251], length 0
14:05:05.039660 IP 10.50.1.11.domain > tdns1.35520: Flags [P.], seq 1:93, ack 42, win 509, options [nop,nop,TS val 382356819 ecr 1158726251], length 92 28344*- 1/0/1 SOA (90)
14:05:05.039693 IP tdns1.35520 > 10.50.1.11.domain: Flags [.], ack 93, win 502, options [nop,nop,TS val 1158726252 ecr 382356819], length 0
14:05:05.040076 IP tdns1.35520 > 10.50.1.11.domain: Flags [P.], seq 42:123, ack 93, win 502, options [nop,nop,TS val 1158726252 ecr 382356819], length 81 40683 [1n] IXFR? sub.domain.tld. (79)
14:05:05.050838 IP 10.50.1.11.domain > tdns1.35520: Flags [P.], seq 93:174, ack 123, win 509, options [nop,nop,TS val 382356830 ecr 1158726252], length 81 40683*- 1/0/0 SOA (79)
14:05:05.091348 IP tdns1.35520 > 10.50.1.11.domain: Flags [.], ack 174, win 502, options [nop,nop,TS val 1158726304 ecr 382356830], length 0
14:05:05.091826 IP 10.50.1.11.domain > tdns1.35520: Flags [P.], seq 174:1268, ack 123, win 509, options [nop,nop,TS val 382356871 ecr 1158726304], length 1094 [prefix length(1011) != length(1092)] (invalid)
14:05:05.091859 IP tdns1.35520 > 10.50.1.11.domain: Flags [.], ack 1268, win 501, options [nop,nop,TS val 1158726304 ecr 382356871], length 0
14:05:10.057169 IP 10.50.1.11.domain > tdns1.35520: Flags [F.], seq 1268, ack 123, win 509, options [nop,nop,TS val 382361836 ecr 1158726304], length 0
14:05:10.057716 IP tdns1.35520 > 10.50.1.11.domain: Flags [F.], seq 123, ack 1269, win 501, options [nop,nop,TS val 1158731270 ecr 382361836], length 0
14:05:10.058101 IP 10.50.1.11.domain > tdns1.35520: Flags [.], ack 124, win 509, options [nop,nop,TS val 382361837 ecr 1158731270], length 0
^C
19 packets captured
19 packets received by filter
0 packets dropped by kernel
```

It would be really great if Technitium could fall back to AXFR in this case, or at least expose an option to configure a secondary zone with something like 'force AXFR on notify'.

**Comment by ShreyasZare** [comment]
Thanks for the details. Technitium DNS server already does AXFR if IXFR fails but in case of PowerDNS, the response is unexpected and causing the zone transfers process to stop completely with error.The tcpdump text output you shared does not contain much details. It would be nice if you can repeat the same test and save the packets in a file and share the file here so that I can update the code to handle this type of response.

**Comment by narf-** [comment]
Thanks for looking into this! 

I've dumped the packets with `tcpdump host 10.50.1.11 -n -w traffic.pcap -v` and attached the file here. Let me know if I can provide more information or data.

[traffic.pcap.zip](https://github.com/user-attachments/files/20266243/traffic.pcap.zip)

**Comment by ShreyasZare** [comment]
@narf- Thanks for the pcap file. The issue is much clear now. It seems that PowerDNS does not support IXFR and responds with AXFR response which is fine, except that they send the first response message with only a single SOA record causing confusion since single SOA in response for IXFR has a different meaning. I am reading RFCs to figure out how to handle this case.

**Comment by ShreyasZare** [comment]
Technitium DNS Server v14.0.1 is now available which resolves this issue. Do upgrade and let me know your feedback.
