### ISSUE TITLE
DnsClient failed to resolve the request

### ISSUE THREAD

**Issue by micmejia** [TechnitiumSoftware/DnsServer#1246]
I have two containers running in a mikrotik router:
- 172.17.0.2: dns-server
- 172.17.0.3: iperf-web

On a fresh install of dns-server, with DNSSEC disabled and no forwarder configured, I run nslookup on 172.17.0.3:

```
Executing command: nslookup instagram.com 172.17.0.2

;; Got SERVFAIL reply from 172.17.0.2
Server: 172.17.0.2
Address: 172.17.0.2#53
** server can't find instagram.com: SERVFAIL

Execution finished!
```

dns-server logs:

```
[2025-03-06 15:50:32 UTC] DNS Server failed to resolve the request 'instagram.com. A IN'.
TechnitiumLibrary.Net.Dns.DnsClientFailureResponseException: DnsClient failed to resolve the request '. NS IN'. Received a response without AuthoritativeAnswer flag set from Name server: m.root-servers.net (202.12.27.33)
   at TechnitiumLibrary.Net.Dns.DnsClient.GetRootServersUsingRootHintsAsync(IDnsCache cache, NetProxy proxy, Boolean preferIPv6, UInt16 udpPayloadSize, Boolean dnssecValidation, Int32 retries, Int32 timeout, CancellationToken cancellationToken) in Z:\Technitium\Projects\TechnitiumLibrary\TechnitiumLibrary.Net\Dns\DnsClient.cs:line 2699
   at TechnitiumLibrary.Net.Dns.DnsClient.RecursiveResolveAsync(DnsQuestionRecord question, IDnsCache cache, NetProxy proxy, Boolean preferIPv6, UInt16 udpPayloadSize, Boolean randomizeName, Boolean qnameMinimization, Boolean dnssecValidation, NetworkAddress eDnsClientSubnet, Int32 retries, Int32 timeout, Int32 concurrency, Int32 maxStackCount, Boolean minimalResponse, Boolean asyncNsRevalidation, Boolean asyncNsResolution, List`1 rawResponses, CancellationToken cancellationToken) in Z:\Technitium\Projects\TechnitiumLibrary\TechnitiumLibrary.Net\Dns\DnsClient.cs:line 973
   at TechnitiumLibrary.TaskExtensions.TimeoutAsync[T](Func`2 func, Int32 timeout, CancellationToken cancellationToken)
   at TechnitiumLibrary.TaskExtensions.TimeoutAsync[T](Func`2 func, Int32 timeout, CancellationToken cancellationToken) in Z:\Technitium\Projects\TechnitiumLibrary\TechnitiumLibrary\TaskExtensions.cs:line 65
   at DnsServerCore.Dns.DnsServer.DefaultRecursiveResolveAsync(DnsQuestionRecord question, NetworkAddress eDnsClientSubnet, IDnsCache dnsCache, Boolean dnssecValidation, Boolean skipDnsAppAuthoritativeRequestHandlers, CancellationToken cancellationToken) in Z:\Technitium\Projects\DnsServer\DnsServerCore\Dns\DnsServer.cs:line 3486
   at DnsServerCore.Dns.DnsServer.RecursiveResolverBackgroundTaskAsync(DnsQuestionRecord question, NetworkAddress eDnsClientSubnet, Boolean advancedForwardingClientSubnet, IReadOnlyList`1 conditionalForwarders, Boolean dnssecValidation, Boolean cachePrefetchOperation, Boolean cacheRefreshOperation, Boolean skipDnsAppAuthoritativeRequestHandlers, TaskCompletionSource`1 taskCompletionSource) in Z:\Technitium\Projects\DnsServer\DnsServerCore\Dns\DnsServer.cs:line 3242
[2025-03-06 15:50:32 UTC] [172.17.0.3:45616] [UDP] QNAME: instagram.com; QTYPE: A; QCLASS: IN; RCODE: ServerFailure; ANSWER: []
```

packet-sniffer:
```
No.	Time	Source	Destination	Protocol	Length	Info
6	6.166010	172.17.0.3	172.17.0.2	DNS	73	Standard query 0x6dea A instagram.com
7	6.169206	172.17.0.2	202.12.27.33	DNS	70	Standard query 0xd4ce NS <Root> OPT
8	6.169434	172.17.0.2	192.33.4.12	DNS	70	Standard query 0x0586 NS <Root> OPT
9	6.176208	202.12.27.33	172.17.0.2	DNS	281	Standard query response 0xd4ce NS <Root> NS c.root-servers.net NS f.root-servers.net NS k.root-servers.net NS d.root-servers.net NS i.root-servers.net NS e.root-servers.net NS g.root-servers.net NS a.root-servers.net NS b.root-servers.net NS j.root-servers.net NS m.root-servers.net NS l.root-servers.net NS h.root-servers.net OPT
10	6.176772	192.33.4.12	172.17.0.2	DNS	281	Standard query response 0x0586 NS <Root> NS e.root-servers.net NS c.root-servers.net NS h.root-servers.net NS f.root-servers.net NS a.root-servers.net NS l.root-servers.net NS i.root-servers.net NS d.root-servers.net NS j.root-servers.net NS b.root-servers.net NS k.root-servers.net NS g.root-servers.net NS m.root-servers.net OPT
11	6.187872	172.17.0.2	172.17.0.3	DNS	73	Standard query response 0x6dea Server failure A instagram.com
```

more packet-sniffer:

```
No.	Time	Source	Destination	Protocol	Length	Info
9	7.566099	172.17.0.3	172.17.0.2	DNS	72	Standard query 0xa312 A facebook.com
10	7.568409	172.17.0.2	192.33.4.12	DNS	70	Standard query 0x9058 NS <Root> OPT
11	7.568630	172.17.0.2	202.12.27.33	DNS	70	Standard query 0xd353 NS <Root> OPT
12	7.575507	192.33.4.12	172.17.0.2	DNS	281	Standard query response 0x9058 NS <Root> NS d.root-servers.net NS b.root-servers.net NS a.root-servers.net NS g.root-servers.net NS i.root-servers.net NS f.root-servers.net NS e.root-servers.net NS l.root-servers.net NS k.root-servers.net NS c.root-servers.net NS m.root-servers.net NS j.root-servers.net NS h.root-servers.net OPT
13	7.575545	202.12.27.33	172.17.0.2	DNS	281	Standard query response 0xd353 NS <Root> NS g.root-servers.net NS a.root-servers.net NS k.root-servers.net NS i.root-servers.net NS d.root-servers.net NS e.root-servers.net NS f.root-servers.net NS j.root-servers.net NS h.root-servers.net NS b.root-servers.net NS m.root-servers.net NS l.root-servers.net NS c.root-servers.net OPT
14	7.582664	172.17.0.2	172.17.0.3	DNS	72	Standard query response 0xa312 Server failure A facebook.com

No.	Time	Source	Destination	Protocol	Length	Info
27	14.060554	172.17.0.3	172.17.0.2	DNS	68	Standard query 0x882e A bing.com
28	14.062271	172.17.0.2	202.12.27.33	DNS	70	Standard query 0xee09 NS <Root> OPT
29	14.062553	172.17.0.2	192.33.4.12	DNS	70	Standard query 0x934b NS <Root> OPT
30	14.068543	202.12.27.33	172.17.0.2	DNS	281	Standard query response 0xee09 NS <Root> NS a.root-servers.net NS e.root-servers.net NS i.root-servers.net NS g.root-servers.net NS l.root-servers.net NS h.root-servers.net NS c.root-servers.net NS d.root-servers.net NS k.root-servers.net NS f.root-servers.net NS m.root-servers.net NS j.root-servers.net NS b.root-servers.net OPT
31	14.071376	192.33.4.12	172.17.0.2	DNS	281	Standard query response 0x934b NS <Root> NS i.root-servers.net NS h.root-servers.net NS l.root-servers.net NS g.root-servers.net NS a.root-servers.net NS b.root-servers.net NS d.root-servers.net NS e.root-servers.net NS k.root-servers.net NS c.root-servers.net NS f.root-servers.net NS j.root-servers.net NS m.root-servers.net OPT
32	14.071446	172.17.0.2	192.33.4.12	ICMP	309	Destination unreachable (Port unreachable)
33	14.076556	172.17.0.2	172.17.0.3	DNS	68	Standard query response 0x882e Server failure A bing.com
```

Attached are the packet files generated via mikrotik and can be viewed by wireshark: 
[packetsniff.zip](https://github.com/user-attachments/files/19111712/packetsniff.zip)

What could be the problem?

If it helps the investigation, I did a ping from 172.17.0.3 to one of the root servers, without problem:
```
No.	Time	Source	Destination	Protocol	Length	Info
7	3.364406	172.17.0.3	192.33.4.12	ICMP	98	Echo (ping) request  id=0x009b, seq=0/0, ttl=64 (reply in 12)
8	3.366319	172.17.0.20	172.17.0.3	TCP	66	43762 → 5000 [ACK] Seq=978 Ack=182 Win=64128 Len=0 TSval=1480980446 TSecr=1820765690
9	3.367092	172.17.0.20	172.17.0.3	TCP	66	43762 → 5000 [ACK] Seq=978 Ack=239 Win=64128 Len=0 TSval=1480980447 TSecr=1820765691
10	3.367789	172.17.0.20	172.17.0.3	TCP	66	43762 → 5000 [ACK] Seq=978 Ack=289 Win=64128 Len=0 TSval=1480980447 TSecr=1820765692
11	3.368494	172.17.0.20	172.17.0.3	TCP	66	43762 → 5000 [ACK] Seq=978 Ack=291 Win=64128 Len=0 TSval=1480980448 TSecr=1820765693
12	3.526067	192.33.4.12	172.17.0.3	ICMP	98	Echo (ping) reply    id=0x009b, seq=0/0, ttl=54 (request in 7)
```

Thanks,
Mic

**Comment by ShreyasZare** [comment]
Thanks for the details. 

`
DnsClient failed to resolve the request '. NS IN'. Received a response without AuthoritativeAnswer flag set from Name server: m.root-servers.net (202.12.27.33)
`

The above error log indicates that the response received from root server does not have AA flag set. This is an indication that your DNS requests are being hijacked and response is being sent by some other DNS server on the network. This is most likely being done by your ISP or your mesh router if its set to hijack DNS queries.

There is no fix for this since this is a validation performed by the DNS server as per the standards. Ignoring this AA flag issue will still have issues with recursive resolution since hijack will cause it to not work correctly. 

I would recommend that you configure a forwarder that uses encrypted DNS protocol so that it cannot be hijacked.

**Comment by ShreyasZare** [comment]
You're welcome. Thanks for the compliments.
